He relaxed after a long day at work; Он расслабился после долгого рабочего дня
We will relax during our vacation next month; Мы будем отдыхать во время отпуска в следующем месяце
They have already relaxed enough for today; Они уже достаточно отдохнули на сегодня
You should relax more and worry less; Тебе следует больше расслабляться и меньше волноваться
If I had more free time, I would relax more often; Если бы у меня было больше свободного времени, я бы чаще отдыхал
He wasn’t relaxing at all during his vacation; he kept working; Он не отдыхал вообще во время отпуска, он продолжал работать
Have you relaxed at all this week?; Ты вообще отдыхал на этой неделе?
They committed a serious mistake during the project; Они совершили серьёзную ошибку во время проекта
Are you committed to this project?; Ты предан этому проекту?
You should commit yourself to achieving your goals; Тебе следует посвятить себя достижению своих целей
If you commit to this project, you will need to work hard; Если ты возьмёшь на себя обязательство по этому проекту, тебе придётся много работать
The crime was committed late at night; Преступление было совершено поздно ночью
He wasn’t committing enough time to the project, so it failed; Он не уделял проекту достаточно времени, поэтому он провалился
Have you committed to this project already?; Ты уже взял на себя обязательства по этому проекту?
She remembers her first day at school very clearly; Она очень хорошо помнит свой первый день в школе
He remembered to turn off the lights before leaving; Он не забыл выключить свет перед уходом
You will remember this moment forever; Ты будешь помнить этот момент всю жизнь(навсегда)
I have remembered where I left my keys; Я вспомнил, где оставил свои ключи
If you remember to call me, I will give you the information; Если ты не забудешь позвонить мне, я дам тебе информацию
Remember to lock the door before you leave!; Не забудь закрыть дверь на замок перед уходом!
I am not remembering things as clearly as I used to; Я уже не помню вещи так ясно, как раньше
Have you remembered to call your mother today?; Ты не забыл позвонить своей матери сегодня?
They were remembering old stories when I joined them; Они вспоминали старые истории, когда я к ним присоединился
He doesn’t remember his childhood very well; Он плохо помнит своё детство
Have you remembered to take your medicine today?; Ты не забыл принять лекарство сегодня?
Do you remember where we met for the first time?; Ты помнишь, где мы впервые встретились?
Had you remembered about the meeting before I called you?; Ты вспомнил о встрече до того, как я тебе позвонил?
He returns home from work at 6 p.m. every day; Он возвращается домой с работы в 6 вечера каждый день
She returned the dress to the store because it didn’t fit; Она вернула платье в магазин, потому что оно не подошло
They will return from vacation next week; Они вернутся из отпуска на следующей неделе
We have returned all the borrowed equipment; Мы вернули все взятое в долг оборудование
The lost wallet was returned to its owner; Потерянный кошелёк был возвращён его владельцу
He returned the book to the library on time; Он вернул книгу в библиотеку вовремя
They were returning from the concert when it started to rain; Они возвращались с концерта, когда начался дождь
By the time I called, he had already returned the car; К тому времени, как я позвонил, он уже вернул машину
By the end of the day, we will have returned all the samples; К концу дня мы вернём все образцы
Have you returned the keys to the landlord?; Ты вернул ключи арендодателю?
He rides his bike to work every day; Он каждый день ездит на работу на велосипеде
She rode a horse for the first time last weekend; Она впервые прокатилась на лошади в прошлые выходные
They have ridden all the attractions in the park; Они прокатились на всех аттракционах в парке
If you had ridden the bus, you would have arrived on time; Если бы ты поехал на автобусе, ты бы прибыл вовремя
Have you ever ridden a horse before?; Ты когда-нибудь катался на лошади раньше?
He runs 5 kilometers every morning; Он бегает 5 километров каждое утро
She ran the company successfully for ten years; Она успешно управляла компанией в течение десяти лет
We have run out of paper in the office; У нас закончилась бумага в офисе
They were running a campaign when I joined the team; Они проводили кампанию, когда я присоединился к команде
This time next year, I will be running my own business; В это время в следующем году я буду управлять своим бизнесом
I won’t run any meetings next week as I will be on vacation; Я не буду проводить встречи на следующей неделе, так как я буду в отпуске
Have you ever run a business before?; Ты когда-нибудь управлял бизнесом раньше?
She always says the right thing at the right time; Она всегда говорит нужные вещи в нужное время
I am saying goodbye to my colleagues today; Сегодня я прощаюсь со своими коллегами
He said he would call, but he never did; Он сказал, что позвонит, но так и не позвонил
I have said everything I needed to say; Я сказал всё, что хотел сказать
You should say what you really think; Тебе следует сказать, что ты действительно думаешь
I am not saying that you are wrong, but I disagree; Я не говорю, что ты не прав, но я не согласен
He doesn’t say much during conversations; Он мало говорит во время разговоров
Have you said everything you wanted to say?; Ты сказал всё, что хотел сказать?
Had you said goodbye to everyone before you left?; Ты попрощался со всеми перед уходом?
I am tackling the new project at work; Я сейчас занимаюсь новым проектом на работе
They will tackle the issue at the next meeting; Они займутся этим вопросом на следующей встрече
You should tackle this assignment as soon as possible; Тебе следует приступить к этому заданию как можно скорее
Have you tackled similar challenges before?; Ты сталкивался(сталкивался) с подобными вызовами раньше?
I have seen this movie several times already; Я уже несколько раз видел этот фильм
We will see what happens at the meeting tomorrow; Посмотрим, что произойдёт на встрече завтра
I am seeing a doctor about my back pain today; Сегодня я иду к врачу из-за болей в спине
If you see him today, tell him I need to talk to him; Если ты увидишь его сегодня, скажи ему, что мне нужно с ним поговорить
The movie was seen by millions of people worldwide; Фильм был просмотрен миллионами людей по всему миру
Have you seen the latest news?; Ты видел последние новости?
Do you see what I mean?; Ты понимаешь, что я имею в виду?
She sent the package yesterday; Она отправила посылку вчера
They will send the invitation by the end of the week; Они отправят приглашение к концу недели
The letter was sent to the wrong address; Письмо было отправлено по неправильному адресу
Have you sent the invitation to John?; Ты отправил приглашение Джону?
He shares his knowledge with everyone; Он делится своими знаниями со всеми
She shared her favorite book with me; Она поделилась своей любимой книгой со мной
Have you shared the presentation with the team?; Ты поделился презентацией с командой?
Do you share your photos on social media?; Ты выкладываешь свои фотографии в соцсети?
We have shown the presentation to the client; Мы показали презентацию клиенту
If I showed you my project, would you give me advice?; Если бы я показал тебе свой проект, ты бы дал мне совет?
Have you shown your work to the professor?; Ты показал свою работу профессору?
She borrows books from the library every week; Она каждую неделю берёт книги из библиотеки
He borrowed money from his friend to pay the bills; Он занял деньги у друга, чтобы оплатить счета
We have borrowed too much from the bank; Мы слишком много заняли у банка
Have you borrowed any books from the library recently?; Ты брал книги в библиотеке в последнее время?
He lends his tools to his neighbors whenever they need them; Он одалживает свои инструменты соседям, когда им это нужно
They will lend us the equipment for the event; Они одолжат нам оборудование для мероприятия
We have lent a considerable amount of money to start-ups; Мы одолжили значительную сумму денег стартапам
If you lend me your car, I will return it with a full tank; Если ты одолжишь мне машину, я верну её с полным баком
Lend me your phone for a minute!; Одолжи мне телефон на минуту!
Have you ever lent your car to a stranger?; Ты когда-нибудь одалживал свою машину незнакомцу?
I am reducing my expenses to save money; Я сейчас сокращаю свои расходы, чтобы сэкономить деньги
They reduced the prices last month; Они снизили цены в прошлом месяце
We will reduce the budget for the next quarter; Мы сократим бюджет на следующий квартал
She has reduced her working hours to have more free time; Она сократила рабочие часы, чтобы иметь больше свободного времени
If you reduce your expenses, you will save more money; Если ты сократишь свои расходы, ты сэкономишь больше денег
Have you reduced your electricity usage recently?; Ты недавно снижал потребление электроэнергии?
She is cutting a cucumber for the sandwich right now; Она сейчас режет огурец для сэндвича
They will buy some cucumbers at the market tomorrow; Они завтра купят огурцы на рынке
I have never tried cucumber soup before; Я никогда раньше не пробовал огуречный суп
Do you exercise at least three times a week?; Ты занимаешься спортом хотя бы три раза в неделю?
Have you read at least the first chapter of the book?; Ты прочитал хотя бы первую главу книги?
I won’t leave until you finish at least half of the work; Я не уйду, пока ты не сделаешь хотя бы половину работы
If you drink at least two liters of water a day, you will feel better; Если ты будешь пить как минимум два литра воды в день, ты будешь чувствовать себя лучше
He reads at least one book a month; Он читает как минимум одну книгу в месяц
He sat by the window and watched the rain; Он сидел у окна и смотрел на дождь
We have sat here for hours, waiting for the bus; Мы сидим здесь уже несколько часов, ожидая автобус
If you sit closer, you will be able to see better; Если ты сядешь ближе, ты сможешь видеть лучше
They were sitting on the beach when the storm started; Они сидели на пляже, когда начался шторм
Have you sat in this chair before?; Ты сидел в этом кресле раньше?
He has gone to the store; Он ушёл в магазин
By the time I arrived, she was gone; Когда я пришёл, её уже не было
By the time you get here, I will have gone; К тому времени, как ты придёшь, я уже уйду
The meeting is over; Встреча окончена
The project will be over by next month; Проект будет завершён к следующему месяцу
The worst part is over now; Худшее уже позади
The function contains executable code and state that determine how it behaves when invoked;Функция содержит исполняемый код и состояние, которые определяют ее поведение при вызове.